{
  "schema_version": "1.0",
  "job_id": "00000000-0000-0000-0000-000000000001",
  "pipeline": {
    "name": "seed_size_shape",
    "version": "2.0.0"
  },
  "qc": {
    "analysis_pass": true
  },
  "traits_emitted": [
    "Object Solidity|IMGSTAT:0000011"
  ],
  "objects": [
    {
      "object_id": "obj_001",
      "traits": {
        "Object Solidity|IMGSTAT:0000011": {
          "value": 1.0111,
          "unit": null
        }
      }
    }
  ],
  "derived_images": []
}
